artist_name,song_title,release_date,album,lyrics
Eminem,Houdini,2024-05-31,The Death of Slim Shady (Coup De Grâce) [Expanded Mourner’s Edition],"479 ContributorsTranslationsРусскийDeutschNorsk (bokmål / riksmål)EspañolTürkçePolskiRomână한국어PortuguêsFrançaisУкраїнськаहिन्दीHoudini Lyrics
Hey, Em, it's Paul
Uh, I was listening to the album
Good fucking luck, you're on your own

Guess who's back, back again?
Shady's back, tell a friend
Guess who's back, guess who's back
Guess who's back, guess who's back
Guess who's back, guess who's back
Guess who's back
(Da-da-da, da, da, da, da, da, da)
(Da-da-da, da, da, da, da)

Well, look what the stork brung
(What?) Little baby devil with the forked tongue
And it's stickin' out, yeah, like a sore thumb
(Bleah) With a forehead that it grew horns from
Still a white jerk
Pullin' up in a Chrysler to the cypher with the vic's, percs and a Bud Light shirt
Lyrical technician, an electrician y'all light work
And I don't gotta play pretend, it's you I make believe
And you know I'm here to stay 'cause me
If I was to ever take a leave, It would be aspirin to break a feve
If I was to ask for Megan Thee Stallion if she would collab with me
Would I really have a shot at a feat? (Ha!)
I don't know, but I'm glad to be back, like
See Eminem LiveGet tickets as low as $80You might also like
Abra-abracadabra
(And for my last trick) I'm 'bout to reach in my bag, bruh
Abra-abracadabra
(And for my last trick, poof) Just like that and I'm back, bruh

Now back in the days of old me
(When) Right around the time I became a dope fiend
Ate some codeine, as a way of coping taste of opiates, case of O.E
​Turned me into smiley face emoji
My shit may not be age appropri—
Ate but I will hit an eight year old in the face with a participation trophy
'Cause I have zero doubts
That this whole world's 'bout to turn into some girl scouts
That censorship bureau's out
To shut me down so when I started this verse
It did start off light-hearted at first
But it feels like I'm targeted
Mind bogglin' how my profit has skyrocketed, look what I pocketed
Yeah, the shit is just like y'all have been light joggin' and I've been running at full speed
And that's why I'm ahead like my noggin, and I'm the fight y'all get in
When you debate who the best but ops I'm white-chalkin' when
I step up to that mic, cock it then
""Oh my god, it's him... not again!""
Abra-abracadabra
(And for my last trick) I'm 'bout to reach in my bag, bruh
Abra-abracadabra
(And for my last trick, poof) Just like that and I'm back, bruh

Sometimes I wonder what the old me'd say
(If what?) If he could see the way shit is today
(Look at this shit, man) He'd probably say that everything is gay
(Like happy!) What's my name, what's my name?

So, how many little kids still wanna act like me?
I'm a bigger prick than cacti be
And that's why these words sting, just like you were being attacked by bees
In the coupe leaning back my seat
Bumpin' R. Kelly's favorite group, the black guy pee's
In my Air Max 90's
White T's walkin' parental advisory
My transgender cat's Siamese
Identifies as black, but acts Chinese
Like a motherfuckin' hacky sack I treat the whole world, 'cause I got it at my feet
How can I explain to you?
That even myself, I'm a danger too
I hop on tracks like a kangaroo
And say a few things or two to anger you
But fuck that, if I think that shit, I'ma say that shit
Cancel me what? Okay, that's it, go ahead, Paul, quit
Snake-ass prick, you male crossdresser, fake-ass bitch
And I'll probably get shit for that
(Watch) But you can all suck my dick, in fact
Fuck them, fuck Dre, fuck Jimmy, fuck me, fuck you, fuck my own kids they're brats (Fuck 'em)
They can screw-off, them and you all
You too, Paul, got two balls, big as RuPaul's, what you thought you saw ain't what you saw
'Cause you're never gon' see me
Caught sleepin' and see the kidnappin' never did happen
Like Sherri Papini, Harry Houdini, I vanish into the thin air as I'm leaving, like
Abra-abracadabra
(And for my last trick) I'm 'bout to reach in my bag, bruh
Abra-abracadabra
(And for my last trick, poof) Just like that and I'm back, bruh143Embed"
Eminem,The Monster,2013-10-29,Curtain Call 2,"585 ContributorsTranslationsTürkçeไทย / Phasa ThaiPortuguêsItalianoFrançaisDeutschРусскийThe Monster Lyrics
I'm friends with the monster that's under my bed
Get along with the voices inside of my head
You're tryin' to save me, stop holdin' your breath
And you think I'm crazy, yeah, you think I'm crazy
I wanted the fame but not the cover of Newsweek
Oh well, guess beggars can't be choosey
Wanted to receive attention for my music
Wanted to be left alone in public, excuse me
For wantin' my cake, and eat it too, and wantin' it both ways
Fame made me a balloon 'cause my ego inflated
When I blew, see, but it was confusing
'Cause all I wanted to do's be the Bruce Lee of loose leaf
Abused ink, used it as a tool when I blew steam
Woo! Hit the lottery, ooh-wee
But with what I gave up to get it was bittersweet
It was like winnin' a used mink
Ironic 'cause I think I'm gettin' so huge I need a shrink
I'm beginnin' to lose sleep: one sheep, two sheep
Goin' coo-coo and kooky as Kool Keith
But I'm actually weirder than you think, 'cause I'm—
I'm friends with the monster that's under my bed
Get along with the voices inside of my head
You're tryin' to save me, stop holdin' your breath
And you think I'm crazy, yeah, you think I'm crazy
Well, that's nothin'
See Eminem LiveGet tickets as low as $80You might also like
New-hoo, ooh-hoo, new-hoo, ooh-hoo, new-hoo, ooh-hoo (Oh)
Well, that's nothin'
New-hoo, ooh-hoo, new-hoo, ooh-hoo, new-hoo, ooh-hoo, new-hoo, ooh-hoo

Now, I ain't much of a poet
But I know somebody once told me to seize the moment and don't squander it
'Cause you never know when it all could be over tomorrow
So I keep conjurin'
Sometimes I wonder where these thoughts spawn from
Yeah, ponderin'll do you wonders
No wonder you're losin' your mind, the way it wanders
(New-hoo, ooh-hoo) Yodel-odel-ay-hee-hoo!
I think it went wanderin' off down yonder
And stumbled onto Jeff VanVonderen
'Cause I need an interventionist
To intervene between me and this monster
And save me from myself and all this conflict
'Cause the very thing that I love's killin' me and I can't conquer it
My OCD's conkin' me in the head, keep knockin'
Nobody's home, I'm sleepwalkin'
I'm just relayin' what the voice in my head's sayin'
Don't shoot the messenger, I'm just friends with the—
I'm friends with the monster that's under my bed
Get along with the voices inside of my head
You're tryin' to save me, stop holdin' your breath
And you think I'm crazy, yeah, you think I'm crazy
Well, that's nothin'
New-hoo, ooh-hoo, new-hoo, ooh-hoo, new-hoo, ooh-hoo (Oh)
Well, that's nothin'
New-hoo, ooh-hoo, new-hoo, ooh-hoo, new-hoo, ooh-hoo, new-hoo, ooh-hoo

Call me crazy, but I have this vision, one day that
I'll walk amongst you a regular civilian
But until then, drums get killed and I'm comin' straight at
MCs, blood gets spilled and I'll
Take you back to the days that I'd get on a Dre track
Give every kid who got played that
Pumped-up feelin' and shit to say back
To the kids who played him
I ain't here to save the fuckin' children
But if one kid out of a hundred million
Who are goin' through a struggle, feels it and relates, that's great
It's payback, Russell Wilson fallin' way back in the draft
Turn nothin' into somethin', still can make that
Straw into gold, chump, I will spin—Rumpelstiltskin in a haystack
Maybe I need a straightjacket
Face facts: I am nuts for real, but I'm okay with that
It's nothin', I'm still friends with the—
I'm friends with the monster that's under my bed
Get along with the voices inside of my head
You're tryin' to save me, stop holdin' your breath
And you think I'm crazy, yeah, you think I'm crazy
I'm friends with the monster that's under my bed
(Get along with) Get along with the voices inside of my head
(You're tryin' to) You're tryin' to save me, stop holdin' your breath
(And you think) And you think I'm crazy, yeah, you think I'm crazy
Well, that's nothin'
New-hoo, ooh-hoo, new-hoo, ooh-hoo, new-hoo, ooh-hoo (Oh)
Well, that's nothin'
New-hoo, ooh-hoo, new-hoo, ooh-hoo, new-hoo, ooh-hoo, new-hoo, ooh-hoo909Embed"
Eminem,Lucky You,2018-08-31,Curtain Call 2,"691 ContributorsTranslationsTürkçeEspañolPortuguêsItalianoFrançaisفارسی中文Lucky You Lyrics
Woah, Joyner, Joyner, yeah, yeah, yeah
Yeah, yeah, yeah, yeah, yeah

Yeah, I done did a lot of things in my day, I admit it
I don't take back what I say, if I said it, then I meant it
All my life I want a Grammy, but I'll prolly never get it
I ain't never had no trophy or no motherfuckin' ribbon (Yeah, yeah, yeah)
Fuck the system, I'm that nigga, bend the law, cut the rules
I'm about to risk it all, I ain't got too much to lose (Yeah, yeah, yeah, yeah)
Y'all been eatin' long enough, it's my turn to cut the food (Yeah)
Pass the plate (Yeah), where my drink (Hol' up)?
This my day (Yeah, yeah), lucky you, fuck you too, woo

Y'all gotta move, y'all gotta move, y'all gotta move
Give me some room (Woo), give me some room (Hey), give me the juice
Hop out the coupe, hop out the coupe, hop out and shoot
Y'all gotta move (Boom, bap), y'all gotta move (Woo), give me the juice

Back on my bullshit, my back to the wall
Turn my back on you, all of you finished (Bap, bop, bop)
Back to these bullets, it's back to the job
Pull my MAC out and all of you runnin' (Yeah, yeah, yeah)
Back on my hood shit, it's back to the pushin'
These packs and I'm actually pumpin'
Can't fuck with you rappers, you practically suckin' (Yeah)
You might'a went platinum but that don't mean nothin'
I'm actually buzzin' this time
Straight out the kitchen, I told 'em the oven is mine
I do not fuck with you guys (Woo)
If I don't kill you, just know you gon' suffer this time (Yeah)
I ain't no gangster, but I got some bangers
Some chains and some blades and a couple of knives
Choppers and jammies, a partridge, a pear tree
My Twelve Days of Christmas was nothin' but lies (I)
Run at you hard like a sumo (Sumo)
They say I talk like a chulo (Chulo)
I live on Mars, I'm not Bruno (Woo)
Bitch, I'm a dog, call me Cujo (Rah)
You play your cards, I reverse on you all
And I might just draw four like a Uno (Bup)
Cállate boca mejor, maricón
Little puto, and all of you culo (Joyner)
They've invented a level up in the ghetto to get old
Lookin' for somethin' I prolly can never find now (Yeah, yeah)
Shit get relevant 'til all the beef die down (Yeah)
In truth, a nigga just really want me tied down (Bop, bop)
I've been alone and I never needed nobody
Just only me and my shawty, I'll tell these niggas to lie down
Keep all the money, I never wanted the lifestyle
I just pray to God that my son'll be alright now (Woo! Woo!)
I said ain't no love for the other side
Or anyone who ever want smoke (Joyner)
When I die I'm goin' out as the underdog who never lost hope (Yeah)
You in the wrong cab, down the wrong path
Nigga, wrong way, wrong road (Woo, woo)
Snakes in the grass tryna slither fast
I just bought a fuckin' lawn mower (Vroom)
See Eminem LiveGet tickets as low as $80You might also like
I done said a lotta things in my day, I admit it
This is payback in a way (Yeah), I regret it that I did it
I done won a couple Grammys, but I sold my soul to get 'em (Ah)
Wasn't in it for the trophies (Nah), just the fuckin' recognition
Fuck's the difference? I'm that cracker, bend the law, fuck the rules
Man, I used to risk it all, now I got too much to lose
I've been eatin' long enough, man, my stomach should be full
I just ate, licked the plate, my buffet, lucky me, fuck you think? (Woo!)

I got a couple of mansions
Still, I don't have any manners
You got a couple of ghostwriters
But to these kids, it don't actually matter
They're askin' me, ""What the fuck happened to hip-hop?""
I said, ""I don't have any answers""
'Cause I took an L when I dropped my last album
It hurt me like hell, but I'm back on these rappers (Yeah)
And actually comin' from humble beginnings
I'm somewhat uncomfortable winning
I wish I could say, ""What a wonderful feeling!
We're on the upswing like we're punchin' the ceiling!""
But nothin' is feeling like anyone has any fuckin' ability
To even stick to a subject, it's killin' me
The inability to pen humility
Ha-ta-ta, ba-ta-ta, why don't we make a bunch of
Fuckin' songs about nothin' and mumble 'em?
Fuck it, I'm goin' for the jugular
Shit is a circus, you clowns that are comin' up
Don't give an ounce of a motherfuck
About the ones that were here before you that made rap (Yeah)
Let's recap, way back, MCs that (What?)
Wreak havoc on tape decks (Woo)
ADAT's, where the G Raps and Kanes at?
We need 3 Stacks ASAP and bring Masta Ace back
'Cause half of these rappers have brain damage
All the lean rappin', face tats, syruped out like tree sap
I don't hate trap (Nah), and I don't wanna seem mad
But in fact (Yeah), where the old me at? The same cat
That would take that feedback and aim back, I need that
But I think it's inevitable they know what button to press
Or what lever to pull to give me to snap though (Lil' bitch)
And if I pay it attention, I'm prob'ly makin' it bigger
But you've been takin' ya dicks and I'm fuckin' back, ho (Get it?)
On the brink, any minute got me thinkin' of finishin'
Everything with acetaminophen and reapin' the benefits
I'm asleep at the wheel again, as I begin to thinkin' about an evil intent of another beat I'ma kill again
'Cause even if I gotta end up eating a pill again
Even ketamine or methamphetamine with the minithin
It better be at least seventy or three-hundred milligram
And I might as well 'cause I'ma end up bein' a villain again
Levels to this shit, I got an elevator
You could never say to me I'm not a fuckin' record breaker (Yeah)
I sound like a broken record every time I break a record
Nobody could ever take away the legacy I made, I never cater
Motherfucker, now I got a right to be this way
I got spite inside my DNA (Yeah)
But I roll 'til the wheels fall off, I'm working tirelessly, ayy
It's the moment y'all been waitin' for like California
Wishin' rain to pour in that drought, y'all
Been prayin' for my downfall (Yeah)
From the 8 Mile to the Southpaw
Still the same Marshall, that outlaw
That they say as a writer might've fell off
I'm back on that bull like the cowboys
So y'all gotta move, yeah, y'all gotta move, yeah, y'all gotta move
Give me some room (Woo), give me some room (Hey), give me the juice
Hop out the coupe (Joyner), hop out the coupe (Joyner), hop out and shoot
Y'all gotta move (Boom, bap), y'all gotta move (Woo), give me the juice810Embed"
Eminem,The Ringer,2018-08-31,Kamikaze,"859 ContributorsTranslationsTürkçeEspañolРусскийPortuguêsItalianoFrançaisThe Ringer Lyrics
*Plane crash*
Yeah (Illa, Illa, Illa)
Yo, I'm just gonna write down my first thoughts, and see where this takes me, ’cause I feel like I wanna punch the world in the fuckin' face right now
Yeah
Let me explain just how to make greatness
Straight out the gate, I'm ’bout to break it down
Ain't no mistakes allowed, but make no mistake, I'm 'bout
To rape the alphabet, I may raise some brows
If I press the issue just to get the anger out (Brrr!)
Full magazine could take Staples out
Savage but ain't thinkin' 'bout no bank account
But bitch, I'm off the chain like Kala Brown
Motherfucker, shut the fuck up when I’m talkin’, lil' bitch
I’m sorry, wait, what's your talent? Oh, critiquin'
My talent? Oh, bitch, I don't know who the fuck y’all are
To give a sub-par bar or even have an opinion of you
You mention me, millions of views, attention in news
I mention you, lose-lose for me, win-win for you
Billions of views, your ten cents are two
Skim through the music to give shit reviews
To get clicks, but bitch, you just lit the fuse
Don't get misconstrued, business as us'
Shit-list renewed, so get shit to do
Or get dissed 'cause I just don't get
What the fuck half the shit is that you're listenin' to
Do you have any idea how much I hate this choppy flow
Everyone copies though? Prob'ly no
Get this fuckin' audio out my Audi, yo, adiós
I can see why people like Lil Yachty, but not me though
Not even dissin', it just ain't for me
All I am simply is just an MC
Maybe ""Stan"" just isn't your cup of tea (Get it?)
Maybe your cup's full of syrup and lean
Maybe I need to stir up shit, preferably
Shake the world up if it were up to me
Paul wants me to chill, y'all want me to ill
I should eat a pill, probably I will
Old me killed the new me, watch him bleed to death
I breathe on the mirror, I don't see my breath
Possibly I'm dead, I must be possessed
Like an evil spell, I'm E-V-I-L (""Evil"" spelled)
Jam a Crest Whitestrip in the tip of my dick
With an ice pick, stick it in a vise grip
Hang it on a spike fence, bang it with a pipe wrench
While I take my ball sack and flick it like a light switch
Like Vice President Mike Pence
Back up on my shit in a sidekick as I lay it on a spike strip
These are things that I'd rather do than hear you on a mic
Since nine tenths of your rhyme is about ice and
Jesus Christ, man, how many times is
Someone gonna fuck on my bitch? (Fuck my side chick!)
You won't ever see Em icy
But as cold as I get on the M-I-C
I polarize shit, so the Thames might freeze
And your skull might split like I bashed you upside it
Bitch, I got the club on smash like a nightstick (Yeah)
Turn down for what?
I ain't loud enough, nah, turn the Valium up (Illa, Illa, Illa)
'Cause I don't know how I'm gonna get your mouths to shut
Now when it doesn't matter what caliber
I spit at, I'll bet a hundred thousand bucks
You'll turn around and just be like, ""Man, how the fuck
Sourpuss gonna get mad just 'cause his album sucks?
And now he wants to take it out on us"" (Ooouuu)
But last week, an ex-fan mailed me a copy
Of The Mathers LP to tell me to study
It'll help me get back to myself and she'll love me (Ooouuu)
I mailed the bitch back and said if I did that
I'd just be like everyone else in the fucking industry
Especially an effing Recovery clone of me (NFing)
So finger-bang, chicken wang, MGK, Igg' Azae'
Lil Pump, Lil Xan imitate Lil Wayne
I should aim at everybody in the game, pick a name
I'm fed up with bein' humble
And rumor is I'm hungry, I'm sure you heard rumblings
I heard you wanna rumble like an empty stomach
I heard your mumblin' but it's jumbled in mumbo-jumbo
The era that I'm from will pummel you, that's what it's comin' to
What the fuck you're gonna do when you run into it?
I'm gonna crumble you and I'll take a number two
And dump on you, if you ain't Joyner
If you ain't Kendrick or Cole or Sean, then you're a goner
I'm 'bout to bring it to anyone in this bitch who want it
I guess when you walk into BK you expect a Whopper
You can order a Quarter Pounder when you go to McDonald's
But if you're lookin' to get a porterhouse you better go get Revival
But y'all are actin' like I tried to serve you up a slider
Maybe the vocals shoulda been auto-tuned
And you woulda bought it
But sayin' I no longer got it
'Cause you missed a line and never caught it
'Cause it went over your head, because you're too stupid to get it
'Cause you're mentally retarded, but pretend to be the smartest
With your expertise and knowledge, but you'll never be an artist
And I'm harder on myself than you could ever be regardless
What I'll never be is flawless, all I'll ever be is honest (Illa, Illa, Illa)
Even when I'm gone they're gonna say I brought it
Even when I hit my forties like a fuckin' alcoholic
With a bottle full of malt liquor
But I couldn't bottle this shit any longer
The fact that I know that I'ma hit my bottom
If I don't pull myself from the jaws of defeat and rise to my feet
I don't see why y'all even started with me
I get in beefs, my enemies die
I don't cease fire 'til at least all are deceased
I'm east side, never be caught slippin'
Now you see why I don't sleep, not even a wink, I don't blink
I don't doze off, I don't even nod to the beats
I don't even close my fuckin' eyes when I sneeze
""Aw, man! That BET cypher was weak, it was garbage
The Thing ain't even orange—oh my God, that's a reach!""
Shout to all my colorblind people
Each and everyone of y'all, if you call a fire engine green
Aquamarine, or you think water is pink
""Dawg, that's a date"" — ""Looks like an olive to me""
""Look, there's an apple!"" — ""No, it's not, it's a peach!""
So finger-bang, Pootie Tang
Burger King, Gucci Gang, dookie, dang
Charlamagne gonna hate anyway, doesn't matter what I say
Give me Donkey of the Day
What a way for 2018 to get underway
But I'm gonna say everything that I wanna say
Welcome to the slaughterhouse, bitch! (Yeah)
Invite 'em in like a One A Day
I'm not done (Preach!)
'Cause I feel like the beast of burden
That line in the sand, was it even worth it?
'Cause the way I see people turning's
Makin' it seem worthless, it's startin' to defeat the purpose
I'm watchin' my fan base shrink to thirds
And I was just tryin' to do the right thing, but word
Has the court of public opinion reached a verdict
Or still yet to be determined?
'Cause I'm determined to be me, critiqued or worshipped
But if I could go back, I'd at least reword it
And say I empathize with the people this evil serpent
Sold the dream to that he's deserted
But I think it's workin'
These verses are makin' him a wee bit nervous
And he's too scurred to answer me with words
'Cause he knows that he will lyrically get murdered
But I know at least he's heard it
'Cause Agent Orange just sent the Secret Service
To meet in person to see if I really think of hurtin' him
Or ask if I'm linked to terrorists
I said, ""Only when it comes to ink and lyricists""
But my beef is more media journalists
(Hold up, hold up, hold up)
I said, my beef is more meaty, a journalist
Can get a mouthful of flesh
And yes, I mean eating a penis
'Cause they've been pannin' my album to death
So I've been givin' the media fingers
Don't wanna turn this to a counseling sesh
But they've been puttin' me through the ringer
So I ain't ironin' shit out with the press
But I just took this beat to the cleanersSee Eminem LiveGet tickets as low as $80You might also like738Embed"
