artist_name,song_title,release_date,album,lyrics
Rihanna,Umbrella,2007-03-29,Good Girl Gone Bad (Japanese Deluxe Edition),"142 ContributorsTranslationsPortuguêsUmbrella Lyrics
Uh-huh, uh-huh (Yeah, Rihanna)
Uh-huh, uh-huh (Good Girl Gone Bad)
Uh-huh, uh-huh (Take three, action)
Uh-huh, uh-huh (Hov)

No clouds in my stones
Let it rain, I hydroplane in the bank
Comin' down with the Dow Jones (Ayy, ayy, ayy)
When the clouds come, we go, we Roc-A-Fella (Ayy-ayy-ayy, ayy)
We fly higher than weather, in G5's or better
You know me (You know me)
In anticipation for precipitation, stack chips for the rainy day
Jay, Rain Man is back (Ayy-ayy-ayy, ayy)
With Little Miss Sunshine, Rihanna, where you at?  (Ayy-ayy-ayy, ayy)
You have my heart, and we'll never be worlds apart
May be in magazines but you'll still be my star
Baby, 'cause in the dark, you can't see shiny cars
And that's when you need me there
With you, I'll always share because

When the sun shine, we shine together
Told you I'll be here forever
Said ""I'll always be your friend""
Took an oath, I'ma stick it out 'til the end
Now that it's rainin' more than ever
Know that we'll still have each other
You can stand under my umbrella
You can stand under my umbrella
Ella-ella, ayy, ayy, ayy
Under my umbrella
Ella-ella, ayy, ayy, ayy
Under my umbrella
Ella-ella, ayy, ayy, ayy
Under my umbrella
Ella-ella, ayy, ayy, ayy, ayy, ayy, ayy
You might also like
These fancy things
Will never come in between
You're part of my entity
Here for infinity
When the war has took its part
When the world has dealt its cards
If the hand is hard
Together, we'll mend your heart because

When the sun shine, we shine together
Told you I'll be here forever
Said ""I'll always be your friend""
Took an oath, I'ma stick it out 'til the end
Now that it's rainin' more than ever
Know that we'll still have each other
You can stand under my umbrella
You can stand under my umbrella
Ella-ella, ayy, ayy, ayy
Under my umbrella
Ella-ella, ayy, ayy, ayy
Under my umbrella
Ella-ella, ayy, ayy, ayy
Under my umbrella
Ella-ella, ayy, ayy, ayy, ayy, ayy, ayy
You can run into my arms
It's okay, don't be alarmed
Come into me
There's no distance in between our love
So, gonna let the rain pour
I'll be all you need and more because

When the sun shine, we shine together
Told you I'll be here forever
Said ""I'll always be your friend""
Took an oath, I'ma stick it out 'til the end
Now that it's rainin' more than ever
Know that we'll still have each other
You can stand under my umbrella
You can stand under my umbrella
Ella-ella, ayy, ayy, ayy
Under my umbrella
Ella-ella, ayy, ayy, ayy
Under my umbrella
Ella-ella, ayy, ayy, ayy
Under my umbrella
Ella-ella, ayy, ayy, ayy, ayy, ayy, ayy

It's rainin', rainin'
Ooh, baby, it's rainin', rainin'
Baby, come into me
Come into me
It's rainin', rainin'
Ooh, baby, it's rainin', rainin'
You can always come into me
Come into me
It's pourin' rain
It's pourin' rain
Come into me
Come into me
It's pourin' rain
It's pourin' rain
Come into me79Embed"
Rihanna,Sex With Me,2016-01-28,ANTI,"124 ContributorsTranslationsEspañolFrançaisSex With Me Lyrics
Sex with me, so amazing
All this all hard work, no vacation
Stay up off my Instagram, pure temptation
Hit a switch on a fake nigga, like a station
Sex with me, so amazing
Sex with me, so amazing

Vodka and water, and a lemon
And a few other things I cannot mention
Oh-na-na-na-na
Five fingers on it (Five fingers)
Hit it like you own it, I'ma hit it like I'm on it
Straight shots of the blue dot
(Shots, shots, shots, shots)
Baby, I'ma pick your poison
Oh-we, ah-yeah, you gon' need it
I'm off that la-la
I'ma get it wet like jacuzzi, ah-yeah

And sex with me, so amazing
All this all hard work, no vacation
Stay up off my Instagram, pure temptation
Sex with me, sex with me, sex with me
So amazing, so amazing, mmmm
You might also like
You know I got the sauce (Sauce), you know I'm saucy
And it's always wet, a bitch never ever had to use lip gloss on it
I'ma need you deeper than six, it's not a coffin
We're not making love, tryna get nasty
Wrap up your drugs, come make me happy
Sex with me is amazing, with her it'll feel alright
The sex doesn't get any better, make it long, let it be all night
I know, I know, I make it hard to let go
Tonight, all night, I'm Monroe
Even if I'm alone

Sex with me, so amazing
All this all hard work, no vacation
Stay up off my Instagram, pure temptation
Hit a switch on a fake nigga, like a station
Sex with me, sex with me, sex with me
So amazing, so amazing, mmmm

Sex with me, so amazing
Sex with me so amazing
(This is the best there is)101Embed"
Rihanna,Bitch Better Have My Money,2015-03-26,,"170 ContributorsTranslationsEspañolPortuguêsBitch Better Have My Money Lyrics
Yayo, yayo
Mula-la
Yayo

Bitch better have my money
Y'all should know me well enough
Bitch better have my money
Please don't call me on my bluff
Pay me what you owe me
Ballin' bigger than LeBron
Bitch, give me your money
Who y'all think y'all frontin' on?

Like bra, bra, bra
Louis XIII, and it's all on me, nigga, you just bought a shot
Kamikaze, if you think that you gon' knock me off the top
Shit, your wife in the backseat of my brand new foreign car
Don't act like you forgot
I call the shots, shots, shots
Like bra, bra, bra
Pay me what you owe me, don't act like you forgot

Bitch better have my money
Bitch better have my money
Pay me what you owe me
Bitch better have my (Bitch better have my)
Bitch better have my (Bitch better have my)
Bitch better have my money
You might also like
Turn up to Rihanna while the whole club fuckin' wasted
Every time I drop by, I am the only thing y'all playin'
In a drop top, doin' hundred, y'all in my rearview mirror racin'
Where y'all at? Where y'all at? Where y'all at? (Where y'all at?)

Like bra, bra, bra
Louis XIII, and it's all on me, nigga, you just bought a shot
Kamikaze, if you think that you gon' knock me off the top
Shit, your wife in the backseat of my brand new foreign car
Don't act like you forgot
I call the shots, shots, shots
Like bra, bra, bra
Pay me what you owe me, don't act like you forgot

Bitch better have my money
Bitch better have my money
Pay me what you owe me
Bitch better have my (Bitch better have my)
Bitch better have my (Bitch better have my)
Bitch better have my money
Bitch better have my money
Bitch better have my money
Pay me what you owe me
Bitch better have my (Bitch better have my)
Bitch better have my (Bitch better have my)
Bitch better have my money
Bitch better have my money
Bitch better have my money
Bitch, bitch, bitch better have my money
Yo, that bitch better have my money
Hold up
My money
Yo, my money
That bitch better have my money
Bitch better have my money780Embed"
Rihanna,Consideration,2016-01-28,ANTI,"116 ContributorsTranslationsEspañolFrançaisConsideration Lyrics
I come flutterin' in from Neverland
Time can never stop me, no, no, no, no
I know you tried to
I come ridin' in on a pale white horse
Handin' out highs to less fortunate
I do advise you
Run it back, run it on back
When you're breakin' it down for me
'Cause I can't hear you
Two times, run it on back
Will it ever make sense to me?

I got to do things my own way, darlin'
Will you ever let me?
Will you ever respect me? No
Do things my own way, darlin'
You should just let me
Why you ain't ever let me grow?
When I look outside my window
I can't get no peace of mind
When I look outside my window
I can't get no peace of mind, oh
You might also like
Let me cover your shit in glitter
I could make it gold, gold
Heard you tryna sell your soul, baby
Word on the street, you run it low lately
I needed you to please give my reflection a break
From the face it's seein' now
Ooh, darlin', would you mind givin' my reflection a break
From the pain it's feelin' now?

I got to do things my own way, darlin'
You should just let me
Will you ever respect me? No
Do things my own way, darlin'
You should just let me
Why you ain't ever let me grow?
When I look outside my window
I can't get no peace of mind
When I look outside my window
I can't get no peace of mind, oh
Get no peace
Get no peace
Get, get, gettin' no peace, oh
Get no peace
Get, g-get no peace, oh135Embed"
Rihanna,What’s My Name?,2010-10-26,Loud (Deluxe Edition),"120 ContributorsTranslationsEspañolPortuguêsEnglishDeutschWhat’s My Name? Lyrics
Oh na-na, what's my name?
Oh na-na, what's my name?
Oh na-na, what's my name?
Oh na-na, what's my name?
Oh na-na, what's my name? (Uh)
What's my name? What's my name? (Yeah)

I heard you good with them soft lips
Yeah, you know, word of mouth
The square root of sixty-nine is eight somethin', right?
'Cause I've been tryna work it out, oh
Good weed, white wine, uh
I come alive in the night time, yeah
Okay, away we go
Only thing we have on is the radio
Let it play
Say you gotta leave, but I know you wanna stay
You just waitin' on the traffic jam to finish, girl
The things that we could do in twenty minutes, girl
Say my name, say my name, wear it out
It's gettin' hot, crack a window, air it out
I can get you through a mighty long day
Soon as you go, the text that I write is gon' say
You might also like
Oh na-na, what's my name?
Oh na-na, what's my name?
Oh na-na, what's my name?
What's my name? What's my name?

Not everybody
Knows how to work my body
Knows how to make me want it
But, boy, you stay up on it
You got that somethin'
That keeps me so off balance
Baby, you're a challenge
Let's explore your talent

Hey, boy, I really wanna see if you
Can go downtown with a girl like me
Hey, boy, I really wanna be with you
'Cause you just my type
Ooh, na, na, na, na
I need a boy to take it over
Lookin' for a guy to put in work
Oh woah, oh woah
Hey, boy, I really wanna see if you
Can go downtown with a girl like me
Hey, boy, I really wanna be with you
'Cause you just my type
Ooh, na, na, na, na
I need a boy to take it over
Lookin' for a guy to put in work
Oh woah, oh woah
Oh na-na, what's my name?
Oh na-na, what's my name?
Oh na-na, what's my name?
What's my name? What's my name?

Baby, you got me
And ain't nowhere that I'd be
Than with your arms around me
Back and forth, you rock me, yeah
So I surrender
To every word you whisper
Every door you enter
I will let you in

Hey, boy, I really wanna see if you
Can go downtown with a girl like me
Hey, boy, I really wanna be with you
'Cause you just my type
Ooh, na, na, na, na
I need a boy to take it over
Lookin' for a guy to put in work
Oh woah, oh woah
You're so amazing
You took the time to figure me out
That's why you take me
Way past the point of turnin' me on
You 'bout to break me
I swear you got me losin' my mind

Oh na-na, what's my name?
Oh na-na, what's my name?
Oh na-na, what's my name?
Oh na-na, what's my name?
Oh na-na, what's my name?
What's my name? What's my name?

Hey, boy, I really wanna see if you
Can go downtown with a girl like me
Hey, boy, I really wanna be with you
'Cause you just my type
Ooh, na, na, na, na
I need a boy to take it over
Lookin' for a guy to put in work
Oh woah, oh woah
Hey, boy, I really wanna see if you
Can go downtown with a girl like me
Hey, boy, I really wanna be with you
'Cause you just my type
Ooh, na, na, na, na
I need a boy to take it over
Lookin' for a guy to put in work
Oh woah, oh woah62Embed"
Rihanna,"Love the Way You Lie, Pt. II",2010-11-12,Loud (Deluxe Edition),"135 ContributorsTranslationsEspañolTürkçeLove the Way You Lie, Pt. II Lyrics
On the first page of our story
The future seemed so bright
Then this thing turned out so evil
I don't know why I'm still surprised
Even angels have their wicked schemes
And you take that to new extremes
But you'll always be my hero
Even though you've lost your mind

Just gonna stand there and watch me burn
Well, that's alright because I like the way it hurts
Just gonna stand there and hear me cry
Well, that's alright because I love the way you lie
I love the way you lie, oh
I love the way you lie

Now there's gravel in our voices
Glass is shattered from the fight
In this tug of war, you'll always win
Even when I'm right
'Cause you feed me fables from your head
With violent words and empty threats
And it's sick that all these battles
Are what keeps me satisfied
You might also like
Just gonna stand there and watch me burn
Well, that's alright because I like the way it hurts
Just gonna stand there and hear me cry
Well, that's alright because I love the way you lie
I love the way you lie, oh
I love the way you lie, oh

So maybe I'm a masochist
I try to run, but I don't wanna ever leave
'Til the walls are going up
In smoke with all our memories

It's morning, you wake, a sunray hits your face
Smeared makeup as we lay in the wake of destruction (Shh)
Hush baby, speak softly, tell me you're awfully sorry
That you pushed me into the coffee table last night so I can push you off me
Try and touch me so I can scream at you not to touch me
Run out the room and I'll follow you like a lost puppy
Baby, without you, I'm nothing, I'm so lost, hug me
Then tell me how ugly I am, but that you'll always love me
Then after that, shove me, in the aftermath of the
Destructive path that we're on, two psychopaths, but we
Know that no matter how many knives we put in each other's backs
That we'll have each other's backs 'cause we're that lucky
Together, we move mountains, let's not make mountains out of molehills
You hit me twice, yeah, but who's counting?
I may have hit you three times, I'm starting to lose count
But together, we'll live forever, we found the youth fountain
Our love is crazy, we're nuts, but I refused counseling
This house is too huge, if you move out, I'll burn all two thousand
Square feet of it to the ground, ain't shit you can do about it
'Cause with you, I'm in my fucking mind, without you, I'm out it
Just gonna stand there and watch me burn
Well, that's alright because I like the way it hurts
Just gonna stand there and hear me cry
Well, that's alright because I love the way you lie
I love the way you lie
I love the way you lie
I love the way you lie
I love the way you lie88Embed"
Rihanna,Desperado,2016-01-28,ANTI,"84 ContributorsTranslationsEspañolFrançaisDesperado Lyrics
Desperado
Sittin' in an old Monte Carlo
A man whose heart is hollow
Mhm, take it easy
I'm not tryna go against yuh
Actually, I'm goin' witcha

Gotta get up out of here
And yuh ain't leavin' me behind
I know you won't cause we share common interests
You need me, there ain't no leaving me behind
Never, no, no, I just want outta here, yeah
Once I'm gone, ain’t no going back

If you want, we can be runaways
Running from any sight of love
Yeah, yeah, there ain’t nothin'
There ain't nothin' here for me
There ain't nothin' here for me anymore
But I don't wanna be alone

Desperado
Sitting on your ole' Monte Carlo
We've both had our hearts broke
Unh, hunh, take it easy
I'm not tryna go against yuh
I can be a lone wolf witcha
You might also like
Gotta get up out of here
And you ain't leaving me behind
I know you won't cause we share common interests
You need me, there ain't no leaving me behind
Never, no, no, both want outta here, yeah
Once we're gone, ain’t no going back

If you want, we can be runaways
Running from any sight of love
Yeah, yeah, there ain’t nothin'
There ain't nothin' here for me
There ain't nothin' here for me anymore
But I don't wanna be alone

Dear desperado
Yeah, I don't wanna be alone
Dear desperado
Yeah, I don't wanna be alone

If you want, we can be runaways
Running from any sight of love
Yeah, yeah, there ain’t nothin'
There ain't nothin' here for me
There ain't nothin' here for me anymore
But I don't wanna be alone
Yeah-yeah-ah
Yeah-yeah-ah
Yeah-yeah-ah
Yeah-yeah-ah
Yeah-yeah-ah
Yeah-yeah-ah78Embed"
Rihanna,California King Bed,2010-11-12,Loud (Deluxe Edition),"52 ContributorsTranslationsहिन्दीEspañolFrançaisCalifornia King Bed Lyrics
Chest to chest (Chest to chest)
Nose to nose (Nose to nose)
Palm to palm
We were always just that close (Just that close)
Wrist to wrist (Wrist to wrist)
Toe to toe (Toe to toe)
Lips that felt just like the inside of a rose

So how come when I reach out my finger
It feels like more than distance between us?

In this California king bed
We're ten thousand miles apart
I've been California wishing on these stars
For your heart, for me
My California king

Eye to eye (Eye to eye)
Cheek to cheek (Cheek to cheek)
Side by side
You were sleeping next to me (Oh, next to me)
Arm in arm
Dusk to dawn
With the curtains drawn
And a little last night on these sheets
You might also like
So how come when I reach out my fingers
It seems like more than distance between us?

In this California king bed
We're ten thousand miles apart
I've been California wishing on these stars
For your heart, for me
My California king

Just when I felt like giving up on us
You turned around and gave me one last touch
That made everything feel better
And even then, my eyes got wetter
So confused, wanna ask you if you love me
But I don't wanna seem so weak
Maybe I've been California dreaming
Hey, hey, hey, hey

In this California king bed
We're ten thousand miles apart
Been California wishing on these stars
For your heart, for me
My California king
My California king

In this California king bed
We're ten thousand miles apart
I've been California wishing on these stars
For your heart, for me
My California king33Embed"
Rihanna,Man Down,2010-11-12,Loud (Deluxe Edition),"98 ContributorsTranslationsEspañolPortuguêsMan Down Lyrics
Sak pasé!

I didn't mean to end his life, I know it wasn't right
I can't even sleep at night, can't get it off my mind
I need to get out of sight 'fore I end up behind bars
What started out as a simple altercation
Turned into a real sticky situation
Me just thinking on the time that I'm facing
Makes me wanna cry

'Cause I didn't mean to hurt him
Coulda been somebody's son
And I took his heart when
I pulled out that gun
Rum-pum-pum-pum, rum-pum-pum-pum, rum-pum-pum-pum
Man down
Rum-pum-pum-pum, rum-pum-pum-pum, rum-pum-pum-pum
Man down

Oh, mama, mama, mama
I just shot a man down
In Central Station
In front of a big ol' crowd
Oh, why?
Oh, why?
Oh, mama, mama, mama
I just shot a man down
In Central Station
You might also like
It's a twenty-two, I call her Peggy Sue
When she fits right down in my shoes
What you expect me to do if you're playing me for a fool?
I will lose my cool and reach for my firearm
I didn't mean to lay him down
But it's too late to turn back now
Don't know what I was thinking
Now he's no longer living
So I'm 'bout to leave town, ayy-uh

'Cause I didn't mean to hurt him
Coulda been somebody's son
And I took his heart when
I pulled out that gun
Rum-pum-pum-pum, rum-pum-pum-pum, rum-pum-pum-pum
Man down
Rum-pum-pum-pum, rum-pum-pum-pum, rum-pum-pum-pum
Man down

Oh, mama, mama, mama
I just shot a man down
In Central Station
In front of a big ol' crowd
Oh, why?
Oh, why?
Oh, mama, mama, mama
I just shot a man down (Would you hear me now?)
In Central Station
Look, I'd never thought I'd do it
Never thought I'd do it
Never thought I'd do it, oh gosh
Whatever happened to me?
Ever happened to me?
Ever happened to me?
Why did I pull the trigger, pull the trigger
Pull the trigger, boom
And end a nigga, end a nigga life so soon?
When mi pull the trigger, pull the trigger
Pull it pon' you
Somebody tell me what I'm gonna, what I'm gonna do? Eh
Rum-pum-pum-pum, rum-pum-pum-pum, rum-pum-pum-pum
Mi say wah man down
A weh mi say
Rum-pum-pum-pum, rum-pum-pum-pum, rum-pum-pum-pum
When mi went downtown
'Cause now I am criminal, criminal, criminal
Oh Lord, oh mercy, now I am a criminal
Man down
Tell the judge please gimme minimal
Run outta town, none a dem can see mi now, see mi now

Oh, mama, mama, mama
I just shot a man down
In Central Station
In front of a big ol' crowd
Oh, why?
Oh, why?
Oh, mama, mama, mama
I just shot a man down
In Central Station80Embed"
Rihanna,Lift Me Up,2022-10-28,Lift Me Up (From Black Panther: Wakanda Forever - Music From and Inspired by),"109 ContributorsTranslationsPortuguêsTürkçeEspañolFrançaisDeutschNederlandsItalianoFrançaisLift Me Up Lyrics
Lift me up
Hold me down
Keep me close
Safe and sound

Burning in a hopeless dream
Hold me when you go to sleep
Keep me in the warmth of your love
When you depart, keep me safe
Safe and sound

Lift me up
Hold me down
Keep me close
Safe and sound

Drowning in an endless sea
Take some time and stay with me
Keep me in the strength of your arms
Keep me safe
Safe and sound
You might also like
Lift me up
Hold me down
Keep me safe
Safe and sound

Burning in a hopeless dream
Hold me when you go to sleep
Keep me safe
We need light, we need love

(Lift me up) Lift me up in your arms
(Hold me down) I need love, I need love, I need love
(Keep me close) Hold me, hold me
(Safe and sound) Hold me, hold me, hold me, hold me
(Lift me up) Hold me, hold me, hold me, hold me
(Hold me down) Hold me, hold me
(Keep me safe) We need light, we need love20Embed"
Rihanna,Loveeeeeee Song,2012-11-19,Unapologetic (Deluxe Version),"104 ContributorsTranslationsFrançaisLoveeeeeee Song Lyrics
Ain't nothin' wrong with it

I don't wanna give you the wrong impression (No, no, no, no)
I need love and affection (Yeah, yeah, yeah)
And I hope I'm not soundin' too desperate
I need love and affection
Love (Oh, oh, oh, oh), love (Oh, oh, oh, oh), love (Oh, oh, oh, oh)
Love and affection
Love (Oh, oh, oh, oh), love (Oh, oh, oh, oh)
L-O-V-E-E-E and affection

Oh, baby, I'm not asking for the world, maybe
You can give me what I want, baby
Come hold me tight and, when I'm drowning, save me
Give it to me on a daily
If I'm your girl, say my name, boy
And let me know I'm in control
We both grown so how we feel we can let it show
(I-I-I) Won't play around
(I-I-I) I wanna lay you down
(I-I-I) I need you now, I need you now
Oh-oh-oh-oh-oh, oh-oh
You might also like
I don't wanna give you the wrong impression (No, no, no, no)
I need love and affection (Yeah, yeah, yeah)
And I hope I'm not sounding too desperate
I need love and affection
Love (Oh, oh, oh, oh), love (Oh, oh, oh, oh), love (Oh, oh, oh, oh)
Love and affection
Love (Oh, oh, oh, oh), love (Oh, oh, oh, oh)
L-O-V-E-E-E and affection

Boy, lately you've been stingy with your time
Got me wonderin, I'm wondering if I'm on your mind
Boy, I just wanna be in your possession
Saying I'm the one you want, so come express it
Don't slip, don't slip, 'cause a nigga might push up on it
Don't really wanna lose this moment
Why window shop when you own this?
(I-I-I) Don't put it down
(I-I-I) Don't fuck around
(I-I-I) I want you now, I want you now
Oh-oh-oh-oh-oh, oh-oh

I don't wanna give you the wrong impression (No, no, no, no)
I need love and affection (Yeah, yeah, yeah)
And I hope I'm not sounding too desperate
I need love and affection
Love (Oh, oh, oh, oh), love (Oh, oh, oh, oh), love (Oh, oh, oh, oh)
Love and affection
Love (Oh, oh, oh, oh), love (Oh, oh, oh, oh)
L-O-V-E-E-E and affection
Can you love me for poor? (Let me know)
I'm searching for my soul (Rockstar)
Who ever turned you cold? (Because)
You need to let him know (Yeah, yeah)
I can work miracles
I'll work your physical (Physical) (Turned up)
And when I love you close
You can feel my heart beating through my clothes, ooh, oh
Future

I don't wanna give you the wrong impression (No, no, no, no)
I need love and affection (Yeah, yeah, yeah), love
And I hope I'm not sounding too desperate
I need love and affection
Love (Oh, oh, oh, oh), love (Oh, oh, oh, oh), love (Oh, oh, oh, oh)
Love and affection
Love (Oh, oh, oh, oh), love (Oh, oh, oh, oh)
L-O-V-E-E-E and affection65Embed"
